{"schema_version":"1.0","id":"feas_20260305_a8d26151","created_at":"2026-03-05T04:59:07.046303+00:00","inputs":{"strategy_spec_path":"artifacts/strategy_specs/20260305/strategy-spec-20260305-d27abe68aeca.strategy_spec.json","variant_name":"directive_exploration","dataset_meta_path":"C:\\Users\\Clamps\\.openclaw\\workspace\\artifacts\\data\\hyperliquid\\ETH\\4h\\20240225T120000Z-20260224T120000Z.meta.json"},"checks":{"history_ok":true,"timeframe_ok":true,"signal_frequency_estimate_ok":true,"parameter_ranges_ok":true,"required_fields_ok":true},"metrics":{"bars_available":4381,"bars_required":3000,"estimated_signal_count":{"long":92,"short":98,"total":190},"estimated_trades_min":190,"fire_count":{"long":92,"short":98,"total":190},"cluster_ratio":0.98947368,"decay_window_bars":48,"param_cliff":{"param_name":"confidence_threshold","base_fire":190,"minus_step_fire":193,"plus_step_fire":187,"ratio_max":1.03208556}},"flags":["SIGNAL_CLUSTERED"],"verdict":"PASS","fail_reasons":[],"suggestion":["raise evidence threshold / require stronger score"]}