{"schema_version":"1.0","id":"feas_20260305_2cb2b07c","created_at":"2026-03-05T06:19:20.119305+00:00","inputs":{"strategy_spec_path":"artifacts/strategy_specs/20260305/strategy-spec-20260305-5edbca146e89.strategy_spec.json","variant_name":"directive_variant_1_gate_adjust","dataset_meta_path":"C:\\Users\\Clamps\\.openclaw\\workspace\\artifacts\\data\\hyperliquid\\SOL\\4h\\20240303T000000Z-20260302T200000Z.meta.json"},"checks":{"history_ok":true,"timeframe_ok":true,"signal_frequency_estimate_ok":true,"parameter_ranges_ok":true,"required_fields_ok":true},"metrics":{"bars_available":4380,"bars_required":3000,"estimated_signal_count":{"long":95,"short":96,"total":191},"estimated_trades_min":191,"fire_count":{"long":95,"short":96,"total":191},"cluster_ratio":0.98429319,"decay_window_bars":48,"param_cliff":{"param_name":"confidence_threshold","base_fire":191,"minus_step_fire":193,"plus_step_fire":187,"ratio_max":1.03208556}},"flags":["SIGNAL_CLUSTERED"],"verdict":"PASS","fail_reasons":[],"suggestion":["raise evidence threshold / require stronger score"]}