{"schema_version":"1.0","id":"feas_20260302_21c84a0e","created_at":"2026-03-02T10:23:16.392397+00:00","inputs":{"strategy_spec_path":"artifacts/strategy_specs/20260302/strategy-spec-20260302-eb7-afbb171b-a2265ba6.strategy_spec.json","variant_name":"template_diversity","dataset_meta_path":"C:\\Users\\Clamps\\.openclaw\\workspace\\artifacts\\data\\hyperliquid\\BTC\\1h\\20260223T040000Z-20260225T030000Z.meta.json"},"checks":{"history_ok":false,"timeframe_ok":true,"signal_frequency_estimate_ok":false,"parameter_ranges_ok":true,"required_fields_ok":true},"metrics":{"bars_available":48,"bars_required":5000,"estimated_signal_count":{"long":1,"short":0,"total":1},"estimated_trades_min":1,"fire_count":{"long":1,"short":0,"total":1},"cluster_ratio":0.0,"decay_window_bars":96,"param_cliff":{"param_name":"rsi_long_min","base_fire":1,"minus_step_fire":1,"plus_step_fire":1,"ratio_max":1.0}},"flags":[],"verdict":"FAIL","fail_reasons":["insufficient history","estimated signals below threshold","FIRE_COUNT_TOO_LOW"],"suggestion":["use longer history dataset","relax threshold or remove filter","increase signal opportunities or loosen gate"]}