{"schema_version":"1.0","id":"feas_20260225_2bf83fa5","created_at":"2026-02-24T23:06:17.257157+00:00","inputs":{"strategy_spec_path":"C:/Users/Clamps/.openclaw/workspace/artifacts/strategy_specs/20260225/strategy-spec-20260225-refine-ade71c28.strategy_spec.json","variant_name":"baseline_exploit_7_exploit_4","dataset_meta_path":"C:\\Users\\Clamps\\.openclaw\\workspace\\artifacts\\datasets\\20260225\\iter2_ETH_1h.meta.json"},"checks":{"history_ok":false,"timeframe_ok":true,"signal_frequency_estimate_ok":true,"parameter_ranges_ok":true,"required_fields_ok":true},"metrics":{"bars_available":4283,"bars_required":12000,"estimated_signal_count":{"long":47,"short":49,"total":96},"estimated_trades_min":96,"fire_count":{"long":47,"short":49,"total":96},"cluster_ratio":0.94791667,"decay_window_bars":96,"param_cliff":{"param_name":"confidence_threshold","base_fire":96,"minus_step_fire":107,"plus_step_fire":94,"ratio_max":1.13829787}},"flags":["SIGNAL_CLUSTERED"],"verdict":"FAIL","fail_reasons":["insufficient history"],"suggestion":["raise evidence threshold / require stronger score","use longer history dataset"]}