{"schema_version":"1.0","id":"feas_20260301_006308e4","created_at":"2026-03-01T10:21:52.076442+00:00","inputs":{"strategy_spec_path":"C:/Users/Clamps/.openclaw/workspace/artifacts/strategy_specs/20260301/strategy-spec-20260301-refine-2a15e1a3.strategy_spec.json","variant_name":"directive_variant_1_exit_change_exploit_6","dataset_meta_path":"C:\\Users\\Clamps\\.openclaw\\workspace\\artifacts\\datasets\\20260301\\iter1_BTC_4h.meta.json"},"checks":{"history_ok":true,"timeframe_ok":true,"signal_frequency_estimate_ok":true,"parameter_ranges_ok":true,"required_fields_ok":true},"metrics":{"bars_available":4014,"bars_required":3000,"estimated_signal_count":{"long":66,"short":69,"total":135},"estimated_trades_min":135,"fire_count":{"long":66,"short":69,"total":135},"cluster_ratio":0.97777778,"decay_window_bars":48,"param_cliff":{"param_name":"confidence_threshold","base_fire":135,"minus_step_fire":138,"plus_step_fire":130,"ratio_max":1.06153846}},"flags":["SIGNAL_CLUSTERED"],"verdict":"PASS","fail_reasons":[],"suggestion":["raise evidence threshold / require stronger score"]}