{"schema_version":"1.0","id":"feas_20260302_1c3e4bbd","created_at":"2026-03-01T20:23:04.639499+00:00","inputs":{"strategy_spec_path":"artifacts/strategy_specs/20260302/strategy-spec-20260302-552-a68c65b7-dbecaaee.strategy_spec.json","variant_name":"template_diversity","dataset_meta_path":"C:\\Users\\Clamps\\.openclaw\\workspace\\artifacts\\data\\hyperliquid\\ETH\\15m\\20260125T140000Z-20260224T140000Z.meta.json"},"checks":{"history_ok":false,"timeframe_ok":true,"signal_frequency_estimate_ok":false,"parameter_ranges_ok":true,"required_fields_ok":true},"metrics":{"bars_available":2881,"bars_required":5000,"estimated_signal_count":{"long":11,"short":11,"total":22},"estimated_trades_min":22,"fire_count":{"long":11,"short":11,"total":22},"cluster_ratio":0.90909091,"decay_window_bars":192,"param_cliff":{"param_name":"confidence_threshold","base_fire":22,"minus_step_fire":24,"plus_step_fire":20,"ratio_max":1.2}},"flags":["SIGNAL_CLUSTERED"],"verdict":"FAIL","fail_reasons":["insufficient history","estimated signals below threshold","FIRE_COUNT_TOO_LOW"],"suggestion":["raise evidence threshold / require stronger score","use longer history dataset","relax threshold or remove filter","increase signal opportunities or loosen gate"]}