{"schema_version":"1.0","id":"feas_20260302_f5e23aaf","created_at":"2026-03-02T07:45:38.594868+00:00","inputs":{"strategy_spec_path":"artifacts/strategy_specs/20260302/strategy-spec-20260302-01c-a42c1b07-23d25496.strategy_spec.json","variant_name":"template_diversity","dataset_meta_path":"C:\\Users\\Clamps\\.openclaw\\workspace\\artifacts\\data\\hyperliquid\\BTC\\15m\\20260105T021500Z-20260226T064500Z.meta.json"},"checks":{"history_ok":true,"timeframe_ok":true,"signal_frequency_estimate_ok":false,"parameter_ranges_ok":true,"required_fields_ok":true},"metrics":{"bars_available":5011,"bars_required":5000,"estimated_signal_count":{"long":17,"short":15,"total":32},"estimated_trades_min":32,"fire_count":{"long":17,"short":15,"total":32},"cluster_ratio":0.8125,"decay_window_bars":192,"param_cliff":{"param_name":"stop_atr_mult","base_fire":32,"minus_step_fire":32,"plus_step_fire":32,"ratio_max":1.0}},"flags":[],"verdict":"FAIL","fail_reasons":["estimated signals below threshold","FIRE_COUNT_TOO_LOW"],"suggestion":["relax threshold or remove filter","increase signal opportunities or loosen gate"]}