{"schema_version":"1.0","id":"feas_20260228_d197caa3","created_at":"2026-02-28T13:22:25.385131+00:00","inputs":{"strategy_spec_path":"artifacts/strategy_specs/20260228/strategy-spec-20260228-claude-er84d6f7.strategy_spec.json","variant_name":"ema_rsi_atr_volatile_trend_balanced","dataset_meta_path":"C:\\Users\\Clamps\\.openclaw\\workspace\\artifacts\\data\\hyperliquid\\BTC\\4h\\20240227T040000Z-20260226T000000Z.meta.json"},"checks":{"history_ok":true,"timeframe_ok":true,"signal_frequency_estimate_ok":true,"parameter_ranges_ok":true,"required_fields_ok":true},"metrics":{"bars_available":4380,"bars_required":3000,"estimated_signal_count":{"long":70,"short":74,"total":144},"estimated_trades_min":144,"fire_count":{"long":70,"short":74,"total":144},"cluster_ratio":0.95833333,"decay_window_bars":48,"param_cliff":{"param_name":"stop_atr_mult","base_fire":144,"minus_step_fire":144,"plus_step_fire":144,"ratio_max":1.0}},"flags":["SIGNAL_CLUSTERED"],"verdict":"PASS","fail_reasons":[],"suggestion":["raise evidence threshold / require stronger score"]}