{"schema_version":"1.0","id":"feas_20260301_6a48e1a1","created_at":"2026-03-01T11:20:48.179998+00:00","inputs":{"strategy_spec_path":"C:/Users/Clamps/.openclaw/workspace/artifacts/strategy_specs/20260301/strategy-spec-20260301-refine-1e9fbc10.strategy_spec.json","variant_name":"directive_variant_1_exit_change_exploit_1","dataset_meta_path":"C:\\Users\\Clamps\\.openclaw\\workspace\\artifacts\\datasets\\20260301\\iter1_BTC_1h.meta.json"},"checks":{"history_ok":false,"timeframe_ok":true,"signal_frequency_estimate_ok":false,"parameter_ranges_ok":true,"required_fields_ok":true},"metrics":{"bars_available":48,"bars_required":5000,"estimated_signal_count":{"long":1,"short":0,"total":1},"estimated_trades_min":1,"fire_count":{"long":1,"short":0,"total":1},"cluster_ratio":0.0,"decay_window_bars":96,"param_cliff":{"param_name":"confidence_threshold","base_fire":1,"minus_step_fire":1,"plus_step_fire":1,"ratio_max":1.0}},"flags":[],"verdict":"FAIL","fail_reasons":["insufficient history","estimated signals below threshold","FIRE_COUNT_TOO_LOW"],"suggestion":["use longer history dataset","relax threshold or remove filter","increase signal opportunities or loosen gate"]}