{"schema_version":"1.0","id":"feas_20260302_9c202b04","created_at":"2026-03-02T09:25:05.193442+00:00","inputs":{"strategy_spec_path":"artifacts/strategy_specs/20260302/strategy-spec-20260302-7fa-feacd30e-27ef85e5.strategy_spec.json","variant_name":"template_diversity","dataset_meta_path":"C:\\Users\\Clamps\\.openclaw\\workspace\\artifacts\\data\\hyperliquid\\ETH\\1h\\20250801T210000Z-20260226T060000Z.meta.json"},"checks":{"history_ok":true,"timeframe_ok":true,"signal_frequency_estimate_ok":true,"parameter_ranges_ok":true,"required_fields_ok":true},"metrics":{"bars_available":5002,"bars_required":5000,"estimated_signal_count":{"long":58,"short":59,"total":117},"estimated_trades_min":117,"fire_count":{"long":58,"short":59,"total":117},"cluster_ratio":0.95726496,"decay_window_bars":96,"param_cliff":{"param_name":"rsi_long_max","base_fire":117,"minus_step_fire":117,"plus_step_fire":117,"ratio_max":1.0}},"flags":["SIGNAL_CLUSTERED"],"verdict":"PASS","fail_reasons":[],"suggestion":["raise evidence threshold / require stronger score"]}