{"schema_version":"1.0","id":"feas_20260225_a8287869","created_at":"2026-02-24T23:05:29.340615+00:00","inputs":{"strategy_spec_path":"artifacts/strategy_specs/20260225/strategy-spec-20260225-64a3d2591bcc.strategy_spec.json","variant_name":"remove_component","dataset_meta_path":"C:\\Users\\Clamps\\.openclaw\\workspace\\artifacts\\datasets\\20260225\\iter3_BTC_4h.meta.json"},"checks":{"history_ok":true,"timeframe_ok":true,"signal_frequency_estimate_ok":true,"parameter_ranges_ok":true,"required_fields_ok":true},"metrics":{"bars_available":4195,"bars_required":3000,"estimated_signal_count":{"long":66,"short":70,"total":136},"estimated_trades_min":136,"fire_count":{"long":66,"short":70,"total":136},"cluster_ratio":0.95588235,"decay_window_bars":48,"param_cliff":{"param_name":"confidence_threshold","base_fire":136,"minus_step_fire":139,"plus_step_fire":132,"ratio_max":1.0530303}},"flags":["SIGNAL_CLUSTERED"],"verdict":"PASS","fail_reasons":[],"suggestion":["raise evidence threshold / require stronger score"]}